{
  "$schema": "https://json-schema.org/draft/2020-12/schema",
  "$id": "https://oge/skills/world-graph-builder/runtime_graph.schema.json",
  "title": "OGE Runtime World Graph (merged, play-ready)",
  "description": "The single game-ready file. It merges each node's behavior, its descriptive stock detail, and its live value into one object, so the game and the graph-update skill both read one artifact. Node values are on the 0-1 scale; edge strength is a 0-1 gain with the direction carried separately in sign. The engine that reads this file is specified in guide/4-the-engine.md. Produced by scripts/build/package_runtime.py.",
  "type": "object",
  "required": ["nodes", "edges"],
  "properties": {
    "scenario": { "type": "string", "description": "scenario slug, e.g. gordian_knot" },
    "version": { "type": "string", "description": "graph version string" },
    "round": { "type": "integer", "minimum": 0, "description": "current round; 0 at package time" },
    "tick": { "type": "integer", "minimum": 0, "description": "global tick counter; 0 at package time (6 ticks per round)" },
    "engine": {
      "type": "object",
      "description": "the canonical engine constants, stamped in so both skills agree on the physics (see guide/4-the-engine.md). rates are the (alpha_up, alpha_down) pairs before the speed multiplier.",
      "properties": {
        "scale_min": { "const": 0 },
        "scale_max": { "const": 1 },
        "sat_a": { "const": 0.38 },
        "speed": { "const": 0.7 },
        "ticks_per_round": { "const": 6 },
        "rates": {
          "type": "object",
          "properties": {
            "Level": { "const": [0.12, 0.22] },
            "Accumulator": { "const": [0.06, 0.13] },
            "Drifter": { "const": [0.10, 0.18] },
            "Lever": { "const": [0.0, 0.0] }
          }
        }
      },
      "additionalProperties": true
    },
    "nodes": {
      "type": "array",
      "minItems": 1,
      "items": { "$ref": "#/$defs/node" }
    },
    "edges": {
      "type": "array",
      "items": { "$ref": "#/$defs/edge" }
    }
  },
  "additionalProperties": true,
  "$defs": {
    "node": {
      "type": "object",
      "required": ["id", "label", "category", "type", "stock_type", "pmesii", "inverted", "baseline", "current_value"],
      "properties": {
        "id": {
          "type": "string",
          "pattern": "^[a-z][a-z0-9_]*$",
          "description": "unique snake_case identifier; the one id space (a node is its own stock detail, not a separate record)"
        },
        "label": { "type": "string", "minLength": 1, "description": "short display name" },
        "name": { "type": "string", "description": "optional longer name" },
        "category": {
          "type": "string",
          "minLength": 1,
          "description": "functional swimlane grouping (scenario-specific, e.g. Levers/Supply/Outcomes). NOT necessarily a PMESII-P dimension."
        },
        "type": {
          "type": "string",
          "enum": ["Level", "Lever", "Accumulator", "Drifter"],
          "description": "the node's behavior; the only behavior field the engine reads. Clock/Ratio/Zero-sum pool fold onto these (see guide/4-the-engine.md)."
        },
        "stock_type": {
          "type": "string",
          "enum": ["zero-sum-pool", "scheduled-threat", "spendable", "service-level", "clock", "buildout", "trust-sentiment", "upstream-access", "policy-lever", "capacity", "other"],
          "description": "the finer semantic class the behavior 'type' is derived from (see guide/1-how-the-model-works.md)"
        },
        "pmesii": {
          "type": "string",
          "enum": ["Political", "Military", "Economic", "Social", "Information", "Infrastructure", "Physical"],
          "description": "the fixed PMESII-P dimension (Physical = Physical Environment)"
        },
        "inverted": {
          "type": "boolean",
          "description": "true when a LOW value is the good state (a threat or compromise node). Load-bearing in the engine: it selects the worse-of term when blending the current and lagged influence, it is not just narration."
        },
        "baseline": {
          "type": "number",
          "minimum": 0,
          "maximum": 1,
          "description": "resting value on the 0-1 index; deviation is measured from this. Fixed at package time."
        },
        "current_value": {
          "type": "number",
          "minimum": 0,
          "maximum": 1,
          "description": "the live runtime value on the 0-1 index. Seeded equal to baseline at package time; the only node field the update skill writes."
        },
        "measures": { "type": "string", "description": "what the node concretely measures" },
        "unit": { "type": "string", "description": "display unit + how it maps to the 0-1 scale" },
        "rationale": { "type": "string", "description": "why this node exists" },
        "increases_when": { "type": "string" },
        "decreases_when": { "type": "string" },
        "sector": { "type": "string", "description": "scenario-specific grouping (free text)" }
      },
      "additionalProperties": true
    },
    "edge": {
      "type": "object",
      "required": ["id", "source", "target", "sign", "strength", "lag", "lag_ticks_elapsed", "mechanism"],
      "properties": {
        "id": { "type": "string", "pattern": "^e_", "description": "unique id, 'e_' prefix" },
        "source": { "type": "string", "description": "id of the driving node" },
        "target": { "type": "string", "description": "id of the affected node" },
        "sign": { "type": "string", "enum": ["+", "-"], "description": "direction of influence" },
        "strength": {
          "type": "number",
          "minimum": 0,
          "maximum": 1,
          "description": "unsigned 0-1 gain (how hard the push is). Bands: weak ~0.2-0.4, moderate ~0.5-0.7, strong ~0.8-1.0. The direction is carried by 'sign', not baked in here."
        },
        "lag": {
          "type": "integer",
          "minimum": 0,
          "description": "transport delay in ticks (6 ticks per round). Selects the source's value 'lag' ticks ago as the lagged comparison term. 0-1 immediate, 2-3 short, 6+ multi-round."
        },
        "lag_ticks_elapsed": {
          "type": "integer",
          "minimum": 0,
          "description": "ticks of source history available to this edge. Seeded 0 at package time; increments every tick; not reset on a direct change."
        },
        "mechanism": {
          "type": "string",
          "minLength": 1,
          "description": "one specific causal sentence: why source moves target"
        }
      },
      "additionalProperties": true
    }
  }
}
