{
  "scenario": "taiwan_strait",
  "version": "1",
  "round": 0,
  "tick": 0,
  "engine": {
    "scale_min": 0,
    "scale_max": 1,
    "sat_a": 0.38,
    "speed": 0.7,
    "ticks_per_round": 6,
    "rates": {
      "Level": [
        0.12,
        0.22
      ],
      "Accumulator": [
        0.06,
        0.13
      ],
      "Drifter": [
        0.1,
        0.18
      ],
      "Lever": [
        0.0,
        0.0
      ]
    }
  },
  "nodes": [
    {
      "id": "us_mil_posture",
      "label": "US Military Posture",
      "category": "Levers",
      "type": "Level",
      "inverted": false,
      "pmesii": "Military",
      "stock_type": "capacity",
      "baseline": 0.6,
      "current_value": 0.6
    },
    {
      "id": "us_dip_pressure",
      "label": "US Diplomatic Pressure",
      "category": "Levers",
      "type": "Lever",
      "inverted": false,
      "pmesii": "Political",
      "stock_type": "policy-lever",
      "baseline": 0.5,
      "current_value": 0.5
    },
    {
      "id": "us_arms_transfers",
      "label": "US Arms Transfers to Taiwan",
      "category": "Levers",
      "type": "Lever",
      "inverted": false,
      "pmesii": "Military",
      "stock_type": "policy-lever",
      "baseline": 0.4,
      "current_value": 0.4
    },
    {
      "id": "us_sanctions_pressure",
      "label": "US Sanctions on PRC",
      "category": "Levers",
      "type": "Lever",
      "inverted": false,
      "pmesii": "Economic",
      "stock_type": "policy-lever",
      "baseline": 0.3,
      "current_value": 0.3
    },
    {
      "id": "cn_blockade_intensity",
      "label": "PRC Blockade Intensity",
      "category": "Levers",
      "type": "Level",
      "inverted": false,
      "pmesii": "Military",
      "stock_type": "capacity",
      "baseline": 0.38,
      "current_value": 0.38
    },
    {
      "id": "cn_econ_coercion",
      "label": "PRC Economic Coercion",
      "category": "Levers",
      "type": "Lever",
      "inverted": false,
      "pmesii": "Economic",
      "stock_type": "policy-lever",
      "baseline": 0.45,
      "current_value": 0.45
    },
    {
      "id": "cn_info_operations",
      "label": "PRC Information Operations",
      "category": "Levers",
      "type": "Level",
      "inverted": false,
      "pmesii": "Information",
      "stock_type": "capacity",
      "baseline": 0.6,
      "current_value": 0.6
    },
    {
      "id": "cn_critical_minerals",
      "label": "PRC Critical Mineral Export Controls",
      "category": "Levers",
      "type": "Lever",
      "inverted": false,
      "pmesii": "Economic",
      "stock_type": "policy-lever",
      "baseline": 0.35,
      "current_value": 0.35
    },
    {
      "id": "cn_nuclear_signaling",
      "label": "PRC Nuclear Signaling",
      "category": "Levers",
      "type": "Lever",
      "inverted": false,
      "pmesii": "Military",
      "stock_type": "policy-lever",
      "baseline": 0.25,
      "current_value": 0.25
    },
    {
      "id": "taiwan_defense_readiness",
      "label": "Taiwan Defense Readiness",
      "category": "Buildouts",
      "type": "Accumulator",
      "inverted": false,
      "pmesii": "Military",
      "stock_type": "buildout",
      "baseline": 0.45,
      "current_value": 0.45
    },
    {
      "id": "taiwan_asym_capability",
      "label": "Taiwan Asymmetric Capability",
      "category": "Buildouts",
      "type": "Accumulator",
      "inverted": false,
      "pmesii": "Military",
      "stock_type": "buildout",
      "baseline": 0.4,
      "current_value": 0.4
    },
    {
      "id": "ally_cohesion",
      "label": "Allied Cohesion (JP/KR/PH)",
      "category": "Buildouts",
      "type": "Level",
      "inverted": false,
      "pmesii": "Political",
      "stock_type": "trust-sentiment",
      "baseline": 0.55,
      "current_value": 0.55
    },
    {
      "id": "us_fwd_basing",
      "label": "US Forward Basing Access",
      "category": "Buildouts",
      "type": "Level",
      "inverted": false,
      "pmesii": "Military",
      "stock_type": "upstream-access",
      "baseline": 0.65,
      "current_value": 0.65
    },
    {
      "id": "semiconductor_supply",
      "label": "Semiconductor Supply Continuity",
      "category": "Supply",
      "type": "Level",
      "inverted": false,
      "pmesii": "Infrastructure",
      "stock_type": "service-level",
      "baseline": 0.65,
      "current_value": 0.65
    },
    {
      "id": "taiwan_export_revenue",
      "label": "Taiwan Export Revenue",
      "category": "Economy",
      "type": "Level",
      "inverted": false,
      "pmesii": "Economic",
      "stock_type": "capacity",
      "baseline": 0.6,
      "current_value": 0.6
    },
    {
      "id": "global_econ_confidence",
      "label": "Global Economic Confidence",
      "category": "Economy",
      "type": "Level",
      "inverted": false,
      "pmesii": "Economic",
      "stock_type": "trust-sentiment",
      "baseline": 0.6,
      "current_value": 0.6
    },
    {
      "id": "foreign_investment_flight",
      "label": "Foreign Investment Flight",
      "category": "Economy",
      "type": "Accumulator",
      "inverted": true,
      "pmesii": "Economic",
      "stock_type": "buildout",
      "baseline": 0.3,
      "current_value": 0.3
    },
    {
      "id": "us_defense_industry",
      "label": "US Defense Industrial Base",
      "category": "Economy",
      "type": "Level",
      "inverted": false,
      "pmesii": "Economic",
      "stock_type": "capacity",
      "baseline": 0.55,
      "current_value": 0.55
    },
    {
      "id": "strait_stability",
      "label": "Strait Stability",
      "category": "Outcomes",
      "type": "Level",
      "inverted": false,
      "pmesii": "Military",
      "stock_type": "service-level",
      "baseline": 0.4,
      "current_value": 0.4
    },
    {
      "id": "escalation_risk",
      "label": "Escalation Risk",
      "category": "Outcomes",
      "type": "Accumulator",
      "inverted": true,
      "pmesii": "Military",
      "stock_type": "buildout",
      "baseline": 0.55,
      "current_value": 0.55
    },
    {
      "id": "cn_mil_credibility",
      "label": "PRC Military Credibility",
      "category": "Outcomes",
      "type": "Accumulator",
      "inverted": false,
      "pmesii": "Military",
      "stock_type": "buildout",
      "baseline": 0.5,
      "current_value": 0.5
    },
    {
      "id": "us_credibility",
      "label": "US Deterrence Credibility",
      "category": "Outcomes",
      "type": "Level",
      "inverted": false,
      "pmesii": "Military",
      "stock_type": "trust-sentiment",
      "baseline": 0.55,
      "current_value": 0.55
    },
    {
      "id": "cn_isolation",
      "label": "PRC International Isolation",
      "category": "Outcomes",
      "type": "Accumulator",
      "inverted": false,
      "pmesii": "Political",
      "stock_type": "buildout",
      "baseline": 0.35,
      "current_value": 0.35
    },
    {
      "id": "humanitarian_pressure",
      "label": "Humanitarian / Refugee Pressure",
      "category": "Outcomes",
      "type": "Accumulator",
      "inverted": true,
      "pmesii": "Social",
      "stock_type": "buildout",
      "baseline": 0.15,
      "current_value": 0.15
    },
    {
      "id": "us_domestic_support",
      "label": "US Domestic Political Support",
      "category": "Pool",
      "type": "Drifter",
      "inverted": false,
      "pmesii": "Political",
      "stock_type": "scheduled-threat",
      "baseline": 0.5,
      "current_value": 0.5
    },
    {
      "id": "cn_domestic_pressure",
      "label": "PRC Domestic Political Pressure",
      "category": "Pool",
      "type": "Drifter",
      "inverted": false,
      "pmesii": "Political",
      "stock_type": "scheduled-threat",
      "baseline": 0.6,
      "current_value": 0.6
    },
    {
      "id": "taiwan_public_resolve",
      "label": "Taiwan Public Resolve",
      "category": "Pool",
      "type": "Level",
      "inverted": false,
      "pmesii": "Social",
      "stock_type": "trust-sentiment",
      "baseline": 0.55,
      "current_value": 0.55
    },
    {
      "id": "taiwan_gov_resolve",
      "label": "Taiwan Government Resolve",
      "category": "Pool",
      "type": "Level",
      "inverted": false,
      "pmesii": "Political",
      "stock_type": "trust-sentiment",
      "baseline": 0.6,
      "current_value": 0.6
    },
    {
      "id": "eu_alignment",
      "label": "EU Strategic Alignment with US",
      "category": "Pool",
      "type": "Level",
      "inverted": false,
      "pmesii": "Political",
      "stock_type": "trust-sentiment",
      "baseline": 0.45,
      "current_value": 0.45
    },
    {
      "id": "asean_neutrality",
      "label": "ASEAN Neutrality",
      "category": "Pool",
      "type": "Level",
      "inverted": false,
      "pmesii": "Political",
      "stock_type": "trust-sentiment",
      "baseline": 0.6,
      "current_value": 0.6
    },
    {
      "id": "information_environment",
      "label": "Information Environment Clarity",
      "category": "Infrastructure",
      "type": "Level",
      "inverted": true,
      "pmesii": "Information",
      "stock_type": "service-level",
      "baseline": 0.45,
      "current_value": 0.45
    },
    {
      "id": "cyber_conflict_intensity",
      "label": "Cyber Conflict Intensity",
      "category": "Infrastructure",
      "type": "Accumulator",
      "inverted": true,
      "pmesii": "Infrastructure",
      "stock_type": "buildout",
      "baseline": 0.5,
      "current_value": 0.5
    },
    {
      "id": "us_intel_advantage",
      "label": "US Intelligence Advantage",
      "category": "Infrastructure",
      "type": "Level",
      "inverted": false,
      "pmesii": "Information",
      "stock_type": "capacity",
      "baseline": 0.6,
      "current_value": 0.6
    }
  ],
  "edges": [
    {
      "id": "e_usmil_uscred",
      "source": "us_mil_posture",
      "target": "us_credibility",
      "sign": "+",